Job Title,Job Category,Company,Salary,Skills Required
Senior Data Scientist,Data Science,TCS,30 LPA,"Data Analysis, Pandas, Statistics, TensorFlow, Python"
Security Analyst,Cybersecurity,Amazon,22 LPA,"Ethical Hacking, Network Security, Python, Incident Response, Firewall Management"
Frontend Developer,Web Development,IBM,15 LPA,"JavaScript, React, HTML, Git, CSS, Responsive Design, Bootstrap"
Digital Marketing Specialist,Digital Marketing,IBM,10 LPA,"Email Marketing, Google Analytics, SEM, Content Marketing, SEO"
Java Developer,Software Engineering,Amazon,14 LPA,"SQL, Maven, Data Structures, Spring Boot, Java, OOP Concepts, Hibernate"
Senior Data Scientist,Data Science,Infosys,25 LPA,"Statistics, Python, SQL, Data Analysis, TensorFlow"
Cloud Engineer,Cloud Computing,Accenture,32 LPA,"Cloud Security, Terraform, Docker, Kubernetes, Linux, AWS"
Senior Data Scientist,Data Science,Meta,30 LPA,"TensorFlow, Machine Learning, Data Analysis, Python, Pandas, SQL, Statistics"
Business Analyst,Business Analysis,Amazon,14 LPA,"Excel, SQL, Power BI, Tableau, Requirement Gathering, Business Analysis, Agile Methodology"
Backend Developer,Web Development,TCS,15 LPA,"APIs, Flask, Django, Python, Git, SQL"
Security Analyst,Cybersecurity,Cisco,22 LPA,"Firewall Management, Incident Response, Network Security, Python, Cryptography"
Data Analyst,Data Science,Infosys,30 LPA,"SQL, Python, Data Visualization, Statistics, Excel, Tableau"
Security Analyst,Cybersecurity,Google,30 LPA,"Python, Incident Response, Ethical Hacking, Network Security, Firewall Management, SIEM"
DevOps Engineer,DevOps,Capgemini,24 LPA,"Kubernetes, AWS, Jenkins, Linux, Docker, CI/CD, Ansible"
Backend Developer,Web Development,Meta,15 LPA,"APIs, Python, Git, Flask"
Security Analyst,Cybersecurity,Amazon,22 LPA,"Incident Response, Python, Ethical Hacking"
DevOps Engineer,DevOps,Infosys,32 LPA,"Kubernetes, CI/CD, AWS, Docker, Linux, Jenkins"
Frontend Developer,Web Development,Infosys,12 LPA,"JavaScript, Git, Responsive Design, CSS, React"
Database Administrator,Database Management,IBM,18 LPA,"Database Design, Backup and Recovery, Oracle"
DevOps Engineer,DevOps,Google,32 LPA,"Jenkins, Kubernetes, AWS, Linux, CI/CD, Docker, Ansible"
Frontend Developer,Web Development,TCS,12 LPA,"CSS, HTML, React, JavaScript, Bootstrap"
Database Administrator,Database Management,Capgemini,15 LPA,"SQL, Database Design, Performance Tuning, Backup and Recovery"
Backend Developer,Web Development,Capgemini,18 LPA,"SQL, APIs, Flask, Django, Git"
Security Analyst,Cybersecurity,Capgemini,22 LPA,"Ethical Hacking, Network Security, Firewall Management, Python"
Java Developer,Software Engineering,Amazon,18 LPA,"OOP Concepts, Maven, SQL, Data Structures, Spring Boot"
Frontend Developer,Web Development,Amazon,18 LPA,"JavaScript, React, Git, CSS"
Business Analyst,Business Analysis,Meta,14 LPA,"Requirement Gathering, Excel, SQL, Business Analysis, Agile Methodology"
Backend Developer,Web Development,Cisco,15 LPA,"Django, Python, Git, APIs, SQL, Flask, Next.js"
Data Analyst,Data Science,Cisco,30 LPA,"SQL, Statistics, Data Visualization, Python"
Cloud Engineer,Cloud Computing,Accenture,32 LPA,"Linux, Kubernetes, Terraform, Docker, Cloud Security"
AI Engineer,Artificial Intelligence,Infosys,30 LPA,"NLP, Computer Vision, Python, PyTorch"
Database Administrator,Database Management,Infosys,20 LPA,"Performance Tuning, Oracle, Backup and Recovery, PostgreSQL"
Backend Developer,Web Development,Google,15 LPA,"APIs, Git, SQL, Django, Next.js"
Database Administrator,Database Management,Microsoft,15 LPA,"Database Design, SQL, Performance Tuning, Oracle, Backup and Recovery, PostgreSQL"
Backend Developer,Web Development,Cisco,15 LPA,"Flask, Django, Python, SQL, APIs"
Backend Developer,Web Development,Meta,12 LPA,"SQL, Git, Django, APIs"
Frontend Developer,Web Development,Amazon,18 LPA,"HTML, Responsive Design, JavaScript, CSS, Bootstrap"
Java Developer,Software Engineering,Meta,18 LPA,"Java, SQL, Data Structures, Spring Boot, Maven, OOP Concepts"
AI Engineer,Artificial Intelligence,Cisco,30 LPA,"Python, Deep Learning, NLP, Computer Vision, TensorFlow"
Senior Data Scientist,Data Science,IBM,20 LPA,"TensorFlow, Python, Statistics, Machine Learning, Data Analysis"
DevOps Engineer,DevOps,Cisco,32 LPA,"Docker, AWS, CI/CD, Kubernetes, Jenkins, Linux"
Data Analyst,Data Science,TCS,20 LPA,"Data Visualization, Tableau, Statistics, Python, Hadoop"
Backend Developer,Web Development,TCS,18 LPA,"APIs, Django, Flask, SQL, Python, Git"
Business Analyst,Business Analysis,Meta,10 LPA,"Excel, Requirement Gathering, SQL, Tableau"
Data Analyst,Data Science,Deloitte,25 LPA,"Tableau, Statistics, Excel, SQL, Python, Data Visualization, Hadoop"
Frontend Developer,Web Development,Deloitte,15 LPA,"React, Git, JavaScript, Responsive Design, Next.js"
Business Analyst,Business Analysis,Google,14 LPA,"Power BI, Excel, SQL, Business Analysis, Requirement Gathering, Tableau"
Cloud Engineer,Cloud Computing,Infosys,32 LPA,"Cloud Security, Docker, Linux, Kubernetes, AWS"
DevOps Engineer,DevOps,Accenture,28 LPA,"Jenkins, Kubernetes, CI/CD, Docker"
AI Engineer,Artificial Intelligence,Capgemini,30 LPA,"Computer Vision, TensorFlow, NLP"
Backend Developer,Web Development,TCS,18 LPA,"Flask, APIs, SQL, Git"
Digital Marketing Specialist,Digital Marketing,Amazon,12 LPA,"Google Analytics, SEO, Content Marketing"
Business Analyst,Business Analysis,Google,10 LPA,"Requirement Gathering, Power BI, Business Analysis, Tableau, Excel, SQL"
Java Developer,Software Engineering,Infosys,14 LPA,"Spring Boot, Java, Data Structures, OOP Concepts, SQL, Maven, JUnit"
Data Analyst,Data Science,Google,30 LPA,"Excel, Data Visualization, Python, Statistics, Tableau"
Frontend Developer,Web Development,IBM,15 LPA,"Git, Responsive Design, HTML, CSS, JavaScript, React"
DevOps Engineer,DevOps,Microsoft,28 LPA,"Kubernetes, Linux, CI/CD, Docker, Jenkins, AWS, Ansible"
Backend Developer,Web Development,Infosys,18 LPA,"Flask, SQL, Django, Python"
Security Analyst,Cybersecurity,Capgemini,30 LPA,"Network Security, Incident Response, Python, Firewall Management, Ethical Hacking"
Cloud Engineer,Cloud Computing,Infosys,28 LPA,"Kubernetes, Terraform, Docker, Cloud Security, Linux"
Frontend Developer,Web Development,Accenture,15 LPA,"CSS, JavaScript, React, HTML"
Data Analyst,Data Science,TCS,25 LPA,"Data Visualization, Tableau, SQL, Excel, Statistics"
Security Analyst,Cybersecurity,Google,26 LPA,"Incident Response, Ethical Hacking, Python, Firewall Management, Network Security"
Security Analyst,Cybersecurity,Meta,26 LPA,"Ethical Hacking, Network Security, Python, Firewall Management, Incident Response"
DevOps Engineer,DevOps,Accenture,28 LPA,"CI/CD, Docker, AWS, Linux, Kubernetes"
Frontend Developer,Web Development,Capgemini,12 LPA,"HTML, JavaScript, Responsive Design, Git"
Business Analyst,Business Analysis,Deloitte,14 LPA,"Business Analysis, SQL, Requirement Gathering, Excel"
Digital Marketing Specialist,Digital Marketing,Accenture,8 LPA,"Google Analytics, Email Marketing, Content Marketing"
DevOps Engineer,DevOps,Amazon,28 LPA,"Docker, CI/CD, Linux, AWS"
DevOps Engineer,DevOps,Microsoft,24 LPA,"Docker, Kubernetes, Jenkins, CI/CD, AWS"
Senior Data Scientist,Data Science,IBM,30 LPA,"Machine Learning, Python, Statistics, SQL, Pandas, TensorFlow"
Database Administrator,Database Management,TCS,15 LPA,"Oracle, Backup and Recovery, Performance Tuning"
AI Engineer,Artificial Intelligence,Deloitte,35 LPA,"TensorFlow, Deep Learning, Python, PyTorch"
Backend Developer,Web Development,Google,15 LPA,"Django, Flask, Python, SQL, Next.js"
AI Engineer,Artificial Intelligence,IBM,30 LPA,"NLP, Deep Learning, TensorFlow"
Senior Data Scientist,Data Science,Cisco,20 LPA,"Machine Learning, Data Analysis, Pandas, Python, Statistics, TensorFlow, PySpark"
Security Analyst,Cybersecurity,Infosys,22 LPA,"Ethical Hacking, Python, Firewall Management, Network Security"
Cloud Engineer,Cloud Computing,Meta,32 LPA,"AWS, Docker, Cloud Security, Terraform"
Cloud Engineer,Cloud Computing,TCS,28 LPA,"Cloud Security, Terraform, Linux, AWS, Docker, Kubernetes"
Senior Data Scientist,Data Science,Capgemini,20 LPA,"Pandas, Data Analysis, Machine Learning, Python, SQL"
Backend Developer,Web Development,Google,18 LPA,"Flask, Git, Django, Python, SQL"
Backend Developer,Web Development,TCS,18 LPA,"Python, APIs, Django, Git, Flask, Bootstrap"
Security Analyst,Cybersecurity,Deloitte,22 LPA,"Network Security, Firewall Management, Python, Ethical Hacking, Incident Response"
Backend Developer,Web Development,Infosys,15 LPA,"APIs, Python, SQL, Django, Bootstrap"
Senior Data Scientist,Data Science,Accenture,25 LPA,"Machine Learning, TensorFlow, Pandas, SQL, Statistics, Python, Data Analysis, PySpark"
Data Analyst,Data Science,Cisco,25 LPA,"SQL, Data Visualization, Excel, Tableau, PySpark"
Java Developer,Software Engineering,Accenture,14 LPA,"Spring Boot, OOP Concepts, Data Structures, Java, SQL, Maven"
AI Engineer,Artificial Intelligence,Google,25 LPA,"Python, Computer Vision, TensorFlow, Deep Learning"
Java Developer,Software Engineering,Infosys,18 LPA,"SQL, OOP Concepts, Maven, Data Structures, Spring Boot, Java"
Java Developer,Software Engineering,Meta,20 LPA,"Maven, Data Structures, OOP Concepts, SQL, Spring Boot, Hibernate"
Frontend Developer,Web Development,Cisco,15 LPA,"JavaScript, HTML, Git, CSS, React, Responsive Design"
DevOps Engineer,DevOps,Cisco,32 LPA,"AWS, Kubernetes, Docker, CI/CD, Linux"
Business Analyst,Business Analysis,TCS,14 LPA,"Excel, Tableau, Business Analysis, SQL"
Database Administrator,Database Management,Infosys,20 LPA,"Database Design, SQL, Backup and Recovery"
Business Analyst,Business Analysis,Capgemini,10 LPA,"Tableau, Business Analysis, Power BI, SQL, Requirement Gathering, Excel, Agile Methodology"
AI Engineer,Artificial Intelligence,Meta,35 LPA,"NLP, Computer Vision, TensorFlow, Deep Learning, Python"
Senior Data Scientist,Data Science,Infosys,30 LPA,"TensorFlow, Data Analysis, Statistics, Python, Machine Learning, SQL, Pandas"
Backend Developer,Web Development,Cisco,18 LPA,"Python, SQL, Django, Flask, Git, APIs"
AI Engineer,Artificial Intelligence,Cisco,25 LPA,"TensorFlow, Python, Deep Learning"
Senior Data Scientist,Data Science,Microsoft,25 LPA,"Statistics, TensorFlow, Data Analysis, Python, Pandas, SQL, Machine Learning, PySpark"
Digital Marketing Specialist,Digital Marketing,Meta,12 LPA,"Email Marketing, SEO, Content Marketing, SEM"
Cloud Engineer,Cloud Computing,Amazon,32 LPA,"Docker, Terraform, AWS, Cloud Security, Kubernetes"
Security Analyst,Cybersecurity,IBM,26 LPA,"Firewall Management, Python, Network Security, SIEM"
Data Analyst,Data Science,TCS,30 LPA,"Excel, SQL, Tableau, Data Visualization, Python, Statistics"
AI Engineer,Artificial Intelligence,Microsoft,30 LPA,"Computer Vision, Python, TensorFlow, Deep Learning"
Database Administrator,Database Management,TCS,18 LPA,"Performance Tuning, Database Design, Backup and Recovery"
Database Administrator,Database Management,Accenture,15 LPA,"SQL, Oracle, Database Design, Backup and Recovery"
Digital Marketing Specialist,Digital Marketing,IBM,12 LPA,"SEO, Google Analytics, Content Marketing, SEM, Email Marketing, Social Media Marketing"
Security Analyst,Cybersecurity,IBM,26 LPA,"Incident Response, Ethical Hacking, Network Security, Python, Firewall Management"
AI Engineer,Artificial Intelligence,Accenture,30 LPA,"NLP, Deep Learning, TensorFlow"
Backend Developer,Web Development,IBM,18 LPA,"Python, Git, Flask, APIs, Django, SQL"
Security Analyst,Cybersecurity,Deloitte,22 LPA,"Incident Response, Network Security, Python, Ethical Hacking, Firewall Management, SIEM"
Backend Developer,Web Development,Cisco,12 LPA,"Django, APIs, Flask, Git, SQL, Python, Bootstrap"
Backend Developer,Web Development,Cisco,18 LPA,"Python, Git, Flask, APIs, Django, Bootstrap"
Digital Marketing Specialist,Digital Marketing,Google,8 LPA,"SEM, Google Analytics, SEO, Email Marketing, Social Media Marketing"
Backend Developer,Web Development,TCS,18 LPA,"Python, Flask, SQL, APIs, Django, Next.js"
AI Engineer,Artificial Intelligence,Amazon,30 LPA,"TensorFlow, Deep Learning, Computer Vision"
AI Engineer,Artificial Intelligence,Google,30 LPA,"Computer Vision, Deep Learning, NLP, TensorFlow, Python"
Cloud Engineer,Cloud Computing,TCS,32 LPA,"AWS, Linux, Terraform, Cloud Security, Kubernetes, Docker"
Digital Marketing Specialist,Digital Marketing,Accenture,12 LPA,"Google Analytics, Content Marketing, SEO"
Java Developer,Software Engineering,Microsoft,20 LPA,"OOP Concepts, Spring Boot, Java, Data Structures, SQL, Hibernate"
DevOps Engineer,DevOps,Cisco,32 LPA,"CI/CD, AWS, Linux, Jenkins, Kubernetes, Ansible"
Database Administrator,Database Management,TCS,18 LPA,"SQL, Backup and Recovery, Database Design, PostgreSQL"
AI Engineer,Artificial Intelligence,Meta,30 LPA,"Python, Deep Learning, NLP"
Cloud Engineer,Cloud Computing,Infosys,25 LPA,"Kubernetes, Docker, Linux, Terraform"
Frontend Developer,Web Development,Accenture,18 LPA,"CSS, Responsive Design, JavaScript, React, Git, Bootstrap"
Frontend Developer,Web Development,Accenture,12 LPA,"Responsive Design, CSS, JavaScript, Git, HTML"
Business Analyst,Business Analysis,Infosys,14 LPA,"SQL, Excel, Power BI, Requirement Gathering, Tableau, Business Analysis, Agile Methodology"
Java Developer,Software Engineering,Accenture,14 LPA,"Java, Data Structures, Spring Boot, Maven, SQL, JUnit"
Backend Developer,Web Development,Infosys,18 LPA,"Python, SQL, APIs, Django, Git"
Security Analyst,Cybersecurity,Capgemini,26 LPA,"Firewall Management, Python, Incident Response, Cryptography"
Database Administrator,Database Management,Cisco,15 LPA,"SQL, Oracle, Backup and Recovery, Database Design, PostgreSQL"
Digital Marketing Specialist,Digital Marketing,Accenture,12 LPA,"Email Marketing, Google Analytics, SEM, SEO, Content Marketing"
AI Engineer,Artificial Intelligence,IBM,25 LPA,"TensorFlow, Computer Vision, Deep Learning"
DevOps Engineer,DevOps,Meta,32 LPA,"AWS, Kubernetes, Jenkins, Linux, Docker"
Backend Developer,Web Development,TCS,15 LPA,"Flask, APIs, Git, SQL, Django, Python"
DevOps Engineer,DevOps,Accenture,28 LPA,"Docker, AWS, Jenkins, Linux, Kubernetes, Ansible"
Security Analyst,Cybersecurity,Deloitte,22 LPA,"Incident Response, Firewall Management, Ethical Hacking, Network Security, Python"
Cloud Engineer,Cloud Computing,Cisco,32 LPA,"Terraform, Docker, Linux, Cloud Security, Azure"
AI Engineer,Artificial Intelligence,Capgemini,25 LPA,"TensorFlow, Deep Learning, Computer Vision, Python, NLP, PyTorch"
Database Administrator,Database Management,Accenture,18 LPA,"Backup and Recovery, Database Design, Oracle"
Security Analyst,Cybersecurity,Infosys,26 LPA,"Ethical Hacking, Python, Firewall Management, Incident Response, Cryptography"
DevOps Engineer,DevOps,Accenture,32 LPA,"Kubernetes, Jenkins, Linux, AWS, Docker"
Data Analyst,Data Science,Infosys,30 LPA,"Python, Data Visualization, Excel, SQL, Tableau, Statistics"
Database Administrator,Database Management,Meta,15 LPA,"SQL, Backup and Recovery, Oracle, Database Design"
Digital Marketing Specialist,Digital Marketing,Accenture,8 LPA,"Email Marketing, SEO, Content Marketing, Google Analytics"
Frontend Developer,Web Development,Accenture,15 LPA,"Responsive Design, React, Git, JavaScript, Next.js"
Java Developer,Software Engineering,Accenture,20 LPA,"Maven, OOP Concepts, SQL, Spring Boot, JUnit"
Backend Developer,Web Development,Accenture,15 LPA,"SQL, Git, Django, Python, APIs"
Backend Developer,Web Development,Cisco,18 LPA,"Git, SQL, Flask, APIs, Django, Bootstrap"
Database Administrator,Database Management,Accenture,18 LPA,"Performance Tuning, Database Design, Oracle, Backup and Recovery, PostgreSQL"
Cloud Engineer,Cloud Computing,Infosys,32 LPA,"AWS, Kubernetes, Docker, Terraform, GCP"
Security Analyst,Cybersecurity,Microsoft,22 LPA,"Ethical Hacking, Firewall Management, Network Security, Python, Incident Response"
Cloud Engineer,Cloud Computing,Amazon,28 LPA,"Terraform, AWS, Linux, Docker"
Business Analyst,Business Analysis,Cisco,14 LPA,"Power BI, Requirement Gathering, Tableau, Excel"
DevOps Engineer,DevOps,Meta,32 LPA,"AWS, Docker, Kubernetes, Jenkins, CI/CD, Linux"
AI Engineer,Artificial Intelligence,Cisco,30 LPA,"Python, TensorFlow, Computer Vision, Deep Learning, NLP"
Security Analyst,Cybersecurity,Deloitte,30 LPA,"Incident Response, Python, Ethical Hacking"
Digital Marketing Specialist,Digital Marketing,Capgemini,12 LPA,"Google Analytics, Content Marketing, Email Marketing, SEM, SEO"
Java Developer,Software Engineering,Deloitte,14 LPA,"Data Structures, Spring Boot, SQL, Maven"
Digital Marketing Specialist,Digital Marketing,Capgemini,12 LPA,"Email Marketing, Content Marketing, SEM, SEO, Google Analytics, Social Media Marketing"
Senior Data Scientist,Data Science,Meta,30 LPA,"TensorFlow, Statistics, Pandas, Machine Learning, Python, Hadoop"
Java Developer,Software Engineering,Microsoft,20 LPA,"Java, SQL, Maven, Spring Boot"
Senior Data Scientist,Data Science,Deloitte,30 LPA,"Statistics, Machine Learning, Python, SQL, Pandas, PySpark"
Database Administrator,Database Management,Meta,20 LPA,"Database Design, Oracle, Backup and Recovery"
DevOps Engineer,DevOps,Capgemini,24 LPA,"CI/CD, Jenkins, Kubernetes, Docker, AWS, Linux"
Security Analyst,Cybersecurity,Microsoft,22 LPA,"Python, Ethical Hacking, Network Security, Incident Response, Firewall Management"
Senior Data Scientist,Data Science,Amazon,25 LPA,"Pandas, TensorFlow, SQL, Python, Statistics, Machine Learning, Data Analysis"
Java Developer,Software Engineering,Infosys,20 LPA,"Spring Boot, SQL, Maven, Data Structures"
Frontend Developer,Web Development,Accenture,12 LPA,"React, HTML, JavaScript, Git, CSS"
Java Developer,Software Engineering,Capgemini,20 LPA,"Maven, OOP Concepts, Spring Boot, SQL, Java, Data Structures"
Backend Developer,Web Development,IBM,12 LPA,"APIs, Python, Django, SQL, Git"
Java Developer,Software Engineering,Infosys,14 LPA,"OOP Concepts, Spring Boot, Java, Maven, SQL"
Java Developer,Software Engineering,Capgemini,14 LPA,"OOP Concepts, SQL, Java, Data Structures, Spring Boot, JUnit"
Security Analyst,Cybersecurity,Capgemini,22 LPA,"Ethical Hacking, Firewall Management, Incident Response, Python"
AI Engineer,Artificial Intelligence,Meta,30 LPA,"Computer Vision, TensorFlow, NLP, Deep Learning, Python"
AI Engineer,Artificial Intelligence,Meta,25 LPA,"TensorFlow, NLP, Python, PyTorch"
Frontend Developer,Web Development,TCS,18 LPA,"Responsive Design, CSS, HTML, JavaScript"
Frontend Developer,Web Development,Accenture,12 LPA,"JavaScript, CSS, Git, HTML, Responsive Design, React"
Data Analyst,Data Science,IBM,25 LPA,"SQL, Statistics, Excel, Python, PySpark"
Senior Data Scientist,Data Science,Meta,30 LPA,"Python, Machine Learning, SQL, Data Analysis, Statistics, TensorFlow, Pandas"
Backend Developer,Web Development,Infosys,18 LPA,"Flask, Git, Python, APIs, Django, Next.js"
Database Administrator,Database Management,Amazon,20 LPA,"SQL, Performance Tuning, Backup and Recovery, Oracle, Database Design, PostgreSQL"
Security Analyst,Cybersecurity,TCS,22 LPA,"Incident Response, Python, Ethical Hacking, Firewall Management, Network Security, Cryptography"
AI Engineer,Artificial Intelligence,Meta,35 LPA,"Python, TensorFlow, Deep Learning, PyTorch"
AI Engineer,Artificial Intelligence,Amazon,30 LPA,"Deep Learning, NLP, TensorFlow, Python, Computer Vision"
Security Analyst,Cybersecurity,Infosys,22 LPA,"Ethical Hacking, Python, Firewall Management, Network Security"
Security Analyst,Cybersecurity,Infosys,30 LPA,"Python, Ethical Hacking, Incident Response, Firewall Management, Network Security"
Cloud Engineer,Cloud Computing,Deloitte,32 LPA,"AWS, Docker, Cloud Security, Kubernetes, Terraform"
DevOps Engineer,DevOps,Accenture,28 LPA,"Linux, Jenkins, Docker, AWS, Ansible"
Java Developer,Software Engineering,Accenture,14 LPA,"SQL, Java, Spring Boot, Data Structures, OOP Concepts, Maven"
Backend Developer,Web Development,Microsoft,15 LPA,"APIs, Git, Python, Django, Flask, SQL, Bootstrap"
DevOps Engineer,DevOps,IBM,28 LPA,"Docker, AWS, Linux, CI/CD, Ansible"
Java Developer,Software Engineering,Cisco,20 LPA,"Data Structures, OOP Concepts, Spring Boot, Maven, Hibernate"
Database Administrator,Database Management,Cisco,20 LPA,"Oracle, Database Design, Backup and Recovery"
Java Developer,Software Engineering,Google,18 LPA,"Data Structures, OOP Concepts, Maven, SQL, Spring Boot, Java"
DevOps Engineer,DevOps,Accenture,28 LPA,"CI/CD, Docker, Linux, Jenkins, Kubernetes"
Data Analyst,Data Science,Meta,25 LPA,"Data Visualization, Python, Excel, Statistics, SQL"
Database Administrator,Database Management,Capgemini,20 LPA,"Performance Tuning, Backup and Recovery, Database Design, Oracle, SQL, PostgreSQL"
Backend Developer,Web Development,Meta,18 LPA,"SQL, Django, Git, Flask"
Security Analyst,Cybersecurity,Deloitte,30 LPA,"Python, Incident Response, Ethical Hacking, Network Security"
Data Analyst,Data Science,Amazon,25 LPA,"Tableau, Python, Statistics, SQL, Excel, PySpark"
Security Analyst,Cybersecurity,Meta,22 LPA,"Incident Response, Ethical Hacking, Network Security, Python"
Data Analyst,Data Science,Cisco,20 LPA,"Tableau, Statistics, Python, Excel, SQL, Data Visualization"
Frontend Developer,Web Development,Meta,18 LPA,"React, Git, JavaScript, Responsive Design"
Backend Developer,Web Development,Infosys,15 LPA,"Django, SQL, APIs, Python, Git"
Cloud Engineer,Cloud Computing,TCS,32 LPA,"Linux, Docker, Cloud Security, Terraform, AWS"
DevOps Engineer,DevOps,Accenture,32 LPA,"Jenkins, Linux, Docker, CI/CD"
Security Analyst,Cybersecurity,TCS,26 LPA,"Incident Response, Network Security, Firewall Management, Python, Ethical Hacking"
Database Administrator,Database Management,Deloitte,20 LPA,"Performance Tuning, Oracle, Backup and Recovery, SQL, Database Design"
AI Engineer,Artificial Intelligence,Microsoft,35 LPA,"NLP, Python, Deep Learning, PyTorch"
Backend Developer,Web Development,Amazon,12 LPA,"SQL, Git, Django, Flask, APIs"
Java Developer,Software Engineering,Meta,18 LPA,"SQL, Java, Data Structures, Spring Boot, Maven"
Frontend Developer,Web Development,Meta,15 LPA,"Responsive Design, CSS, HTML, React, Git"
Digital Marketing Specialist,Digital Marketing,Deloitte,8 LPA,"SEO, Content Marketing, Email Marketing, Google Analytics"
Senior Data Scientist,Data Science,IBM,30 LPA,"Python, TensorFlow, SQL, Pandas, Machine Learning, Statistics"
DevOps Engineer,DevOps,IBM,32 LPA,"Docker, AWS, Kubernetes, CI/CD"
Java Developer,Software Engineering,Deloitte,18 LPA,"OOP Concepts, Java, Spring Boot, SQL, Maven"
Data Analyst,Data Science,Google,25 LPA,"Python, Data Visualization, Tableau, SQL, Statistics, Excel"
AI Engineer,Artificial Intelligence,Microsoft,30 LPA,"TensorFlow, Python, NLP"
Security Analyst,Cybersecurity,IBM,30 LPA,"Incident Response, Network Security, Firewall Management, Ethical Hacking, Python"
Frontend Developer,Web Development,Deloitte,18 LPA,"HTML, React, Responsive Design, CSS, Git"
Senior Data Scientist,Data Science,Capgemini,30 LPA,"TensorFlow, Statistics, Data Analysis, Machine Learning, Python, SQL, Hadoop"
Security Analyst,Cybersecurity,Meta,26 LPA,"Network Security, Python, Incident Response, Ethical Hacking, Firewall Management"
Digital Marketing Specialist,Digital Marketing,Meta,10 LPA,"Google Analytics, Content Marketing, SEO, Email Marketing, SEM"
Database Administrator,Database Management,Accenture,18 LPA,"Performance Tuning, SQL, Database Design, Oracle"
Database Administrator,Database Management,Infosys,15 LPA,"Database Design, Backup and Recovery, Performance Tuning, SQL, PostgreSQL"
Backend Developer,Web Development,Microsoft,15 LPA,"Flask, Django, APIs, SQL, Git"
Digital Marketing Specialist,Digital Marketing,Accenture,8 LPA,"SEO, SEM, Google Analytics, Content Marketing"
Security Analyst,Cybersecurity,Capgemini,22 LPA,"Ethical Hacking, Network Security, Python, Incident Response"
Data Analyst,Data Science,Deloitte,25 LPA,"Excel, Python, Statistics, Data Visualization, SQL"
Data Analyst,Data Science,Cisco,30 LPA,"Python, SQL, Tableau, Excel, Statistics, PySpark"
Frontend Developer,Web Development,Cisco,18 LPA,"JavaScript, Git, Responsive Design, React"
Backend Developer,Web Development,TCS,18 LPA,"APIs, Python, Flask, SQL, Django, Bootstrap"
Senior Data Scientist,Data Science,Cisco,20 LPA,"Python, SQL, Data Analysis, TensorFlow, Statistics"
Frontend Developer,Web Development,Google,18 LPA,"Responsive Design, CSS, React, JavaScript, Git, HTML, Next.js"
Backend Developer,Web Development,Cisco,18 LPA,"Git, Django, APIs, Flask, Python"
Database Administrator,Database Management,Google,15 LPA,"Backup and Recovery, Database Design, Oracle, Performance Tuning, PostgreSQL"
Data Analyst,Data Science,IBM,20 LPA,"Statistics, Data Visualization, Excel, Tableau, Python, SQL, Hadoop"
Data Analyst,Data Science,TCS,30 LPA,"Excel, Statistics, Tableau, SQL"
Frontend Developer,Web Development,Deloitte,12 LPA,"React, Git, HTML, JavaScript, Responsive Design"
Senior Data Scientist,Data Science,Accenture,30 LPA,"SQL, TensorFlow, Pandas, Data Analysis, Statistics, PySpark"
Business Analyst,Business Analysis,Microsoft,10 LPA,"SQL, Business Analysis, Tableau, Power BI, Requirement Gathering, Excel, Agile Methodology"
Security Analyst,Cybersecurity,TCS,26 LPA,"Firewall Management, Network Security, Incident Response, Python"
Database Administrator,Database Management,Microsoft,20 LPA,"SQL, Performance Tuning, Database Design, Backup and Recovery, Oracle"
Digital Marketing Specialist,Digital Marketing,Amazon,10 LPA,"Content Marketing, Email Marketing, Google Analytics, SEO, Social Media Marketing"
Security Analyst,Cybersecurity,Microsoft,30 LPA,"Firewall Management, Network Security, Ethical Hacking, Python"
Java Developer,Software Engineering,Cisco,14 LPA,"Java, SQL, Data Structures, Maven, OOP Concepts, Spring Boot"
Senior Data Scientist,Data Science,Accenture,30 LPA,"Data Analysis, Statistics, Machine Learning, Python, SQL, PySpark"
