Job Title,Job Category,Company,Salary,Skills Required
AI Engineer,Artificial Intelligence,Deloitte,25 LPA,"TensorFlow, Deep Learning, Python, NLP, Computer Vision, PyTorch"
Frontend Developer,Web Development,Accenture,15 LPA,"HTML, CSS, Git, JavaScript, React, Bootstrap"
Java Developer,Software Engineering,Meta,14 LPA,"OOP Concepts, SQL, Maven, Data Structures, Spring Boot"
Backend Developer,Web Development,Meta,12 LPA,"APIs, SQL, Django, Git"
Senior Data Scientist,Data Science,Cisco,20 LPA,"Statistics, TensorFlow, Data Analysis, Machine Learning, SQL, Pandas, Python"
Digital Marketing Specialist,Digital Marketing,Microsoft,8 LPA,"Content Marketing, SEM, Email Marketing, SEO, Social Media Marketing"
Digital Marketing Specialist,Digital Marketing,Google,10 LPA,"SEM, Google Analytics, Content Marketing"
Senior Data Scientist,Data Science,TCS,30 LPA,"SQL, TensorFlow, Pandas, Statistics, Python, Machine Learning"
Frontend Developer,Web Development,Amazon,18 LPA,"CSS, HTML, JavaScript, Git, React"
Business Analyst,Business Analysis,TCS,16 LPA,"Requirement Gathering, Excel, Power BI, SQL, Business Analysis"
Senior Data Scientist,Data Science,Google,20 LPA,"SQL, Machine Learning, Statistics, Pandas, Data Analysis"
Java Developer,Software Engineering,TCS,14 LPA,"Maven, Java, Data Structures, SQL, OOP Concepts, JUnit"
Senior Data Scientist,Data Science,Infosys,20 LPA,"Data Analysis, TensorFlow, Machine Learning, Pandas, Python, Statistics, Hadoop"
Frontend Developer,Web Development,Google,15 LPA,"CSS, Responsive Design, React, Git"
Backend Developer,Web Development,Amazon,18 LPA,"Flask, APIs, Python, Git"
Data Analyst,Data Science,IBM,25 LPA,"SQL, Python, Data Visualization, Statistics, Tableau"
DevOps Engineer,DevOps,Deloitte,28 LPA,"Docker, CI/CD, Linux, Kubernetes"
Senior Data Scientist,Data Science,Amazon,30 LPA,"TensorFlow, Pandas, Python, Machine Learning, Statistics"
Frontend Developer,Web Development,Accenture,12 LPA,"JavaScript, Responsive Design, Git, HTML, CSS, React"
DevOps Engineer,DevOps,Microsoft,24 LPA,"Jenkins, Docker, AWS, Kubernetes, CI/CD"
Security Analyst,Cybersecurity,Cisco,26 LPA,"Network Security, Ethical Hacking, Firewall Management, Incident Response"
Java Developer,Software Engineering,Meta,14 LPA,"OOP Concepts, Spring Boot, SQL, Data Structures, Java"
Digital Marketing Specialist,Digital Marketing,Amazon,8 LPA,"SEM, Content Marketing, SEO, Google Analytics"
Senior Data Scientist,Data Science,Amazon,25 LPA,"Pandas, Statistics, Python, Data Analysis, TensorFlow"
AI Engineer,Artificial Intelligence,Accenture,35 LPA,"NLP, Python, Deep Learning"
Senior Data Scientist,Data Science,TCS,20 LPA,"Machine Learning, Python, TensorFlow, SQL, Pandas, Hadoop"
Data Analyst,Data Science,Meta,20 LPA,"SQL, Statistics, Tableau, Data Visualization"
Data Analyst,Data Science,Accenture,20 LPA,"Excel, Statistics, Tableau, SQL, PySpark"
Data Analyst,Data Science,Cisco,30 LPA,"Data Visualization, Statistics, Excel, Tableau, Python"
Frontend Developer,Web Development,IBM,18 LPA,"Responsive Design, HTML, JavaScript, React, Git, CSS"
Cloud Engineer,Cloud Computing,Meta,25 LPA,"Terraform, Cloud Security, Linux, Docker"
AI Engineer,Artificial Intelligence,Microsoft,25 LPA,"NLP, Python, Deep Learning, PyTorch"
Data Analyst,Data Science,Capgemini,20 LPA,"Tableau, Statistics, SQL, Excel, Data Visualization, Python, PySpark"
Senior Data Scientist,Data Science,Capgemini,25 LPA,"Statistics, Python, Machine Learning, Data Analysis, Pandas, SQL, PySpark"
Database Administrator,Database Management,Deloitte,15 LPA,"Performance Tuning, Backup and Recovery, Oracle, Database Design, SQL"
AI Engineer,Artificial Intelligence,Microsoft,35 LPA,"NLP, Python, Deep Learning"
Digital Marketing Specialist,Digital Marketing,Infosys,12 LPA,"Google Analytics, Email Marketing, SEM, Social Media Marketing"
DevOps Engineer,DevOps,Capgemini,24 LPA,"AWS, Kubernetes, Linux, Docker"
Digital Marketing Specialist,Digital Marketing,Deloitte,10 LPA,"SEM, Content Marketing, Email Marketing, SEO, Google Analytics"
Senior Data Scientist,Data Science,Capgemini,20 LPA,"TensorFlow, Pandas, SQL, Data Analysis, Python, Statistics"
Cloud Engineer,Cloud Computing,Meta,32 LPA,"Linux, Kubernetes, Docker, Cloud Security, Azure"
Business Analyst,Business Analysis,Meta,14 LPA,"SQL, Requirement Gathering, Tableau, Business Analysis, Agile Methodology"
DevOps Engineer,DevOps,Amazon,32 LPA,"CI/CD, Linux, Kubernetes, Docker, AWS, Jenkins"
Security Analyst,Cybersecurity,Google,26 LPA,"Firewall Management, Python, Incident Response, Ethical Hacking, SIEM"
DevOps Engineer,DevOps,IBM,24 LPA,"AWS, Kubernetes, Jenkins, Linux, Docker, CI/CD"
Security Analyst,Cybersecurity,Cisco,22 LPA,"Incident Response, Network Security, Python"
Cloud Engineer,Cloud Computing,Infosys,32 LPA,"Docker, Terraform, Cloud Security, Kubernetes, AWS, Linux"
Database Administrator,Database Management,Cisco,15 LPA,"Backup and Recovery, Performance Tuning, Oracle, PostgreSQL"
Java Developer,Software Engineering,Cisco,14 LPA,"SQL, OOP Concepts, Data Structures, Maven, Java, Spring Boot"
Java Developer,Software Engineering,Google,18 LPA,"SQL, Data Structures, OOP Concepts, Java, JUnit"
Frontend Developer,Web Development,Deloitte,12 LPA,"React, Responsive Design, Git, HTML"
Security Analyst,Cybersecurity,Google,26 LPA,"Network Security, Ethical Hacking, Incident Response, Firewall Management"
Frontend Developer,Web Development,Google,12 LPA,"CSS, React, HTML, JavaScript"
AI Engineer,Artificial Intelligence,Meta,25 LPA,"TensorFlow, NLP, Python, Computer Vision, Deep Learning"
AI Engineer,Artificial Intelligence,Capgemini,30 LPA,"TensorFlow, NLP, Python"
Cloud Engineer,Cloud Computing,Microsoft,32 LPA,"Cloud Security, Terraform, Linux, Kubernetes, Docker, AWS"
Java Developer,Software Engineering,Microsoft,18 LPA,"Java, OOP Concepts, Data Structures, Spring Boot"
Senior Data Scientist,Data Science,Amazon,30 LPA,"SQL, Pandas, TensorFlow, Data Analysis, Machine Learning, Python"
Data Analyst,Data Science,IBM,25 LPA,"SQL, Python, Tableau, Statistics, Excel, Data Visualization, PySpark"
Senior Data Scientist,Data Science,Deloitte,30 LPA,"Data Analysis, Python, TensorFlow, SQL, Pandas, Machine Learning, Statistics"
Java Developer,Software Engineering,TCS,20 LPA,"Maven, Java, Spring Boot, OOP Concepts, Data Structures"
Data Analyst,Data Science,IBM,30 LPA,"Tableau, Python, Data Visualization, Excel"
Java Developer,Software Engineering,TCS,18 LPA,"OOP Concepts, Spring Boot, Data Structures, Java, Maven, SQL, Hibernate"
Data Analyst,Data Science,Amazon,30 LPA,"Statistics, Python, Data Visualization, Excel"
Java Developer,Software Engineering,Meta,20 LPA,"SQL, OOP Concepts, Maven, Java, Data Structures"
Frontend Developer,Web Development,Meta,12 LPA,"Responsive Design, Git, JavaScript, HTML, CSS"
Data Analyst,Data Science,Infosys,25 LPA,"Statistics, Tableau, Data Visualization, Excel, SQL, Python"
Senior Data Scientist,Data Science,Amazon,25 LPA,"Pandas, Machine Learning, Statistics, Data Analysis, TensorFlow, SQL, Hadoop"
DevOps Engineer,DevOps,IBM,32 LPA,"Linux, Kubernetes, AWS, CI/CD, Ansible"
Backend Developer,Web Development,Infosys,12 LPA,"Git, Django, Python, SQL, Flask, APIs"
AI Engineer,Artificial Intelligence,Google,35 LPA,"TensorFlow, NLP, Computer Vision, PyTorch"
DevOps Engineer,DevOps,IBM,28 LPA,"CI/CD, Docker, Kubernetes, Jenkins, AWS, Linux, Ansible"
Database Administrator,Database Management,Meta,18 LPA,"Oracle, Performance Tuning, Database Design"
Data Analyst,Data Science,Meta,25 LPA,"Data Visualization, Statistics, Tableau, Excel, Python"
Business Analyst,Business Analysis,IBM,16 LPA,"SQL, Requirement Gathering, Business Analysis, Excel, Tableau, Agile Methodology"
Data Analyst,Data Science,Microsoft,30 LPA,"Tableau, Excel, Data Visualization, SQL"
Security Analyst,Cybersecurity,IBM,26 LPA,"Python, Ethical Hacking, Incident Response"
Cloud Engineer,Cloud Computing,Microsoft,28 LPA,"Linux, Docker, Terraform, Cloud Security, Kubernetes, AWS"
Database Administrator,Database Management,Amazon,20 LPA,"Backup and Recovery, Oracle, Database Design, SQL, Performance Tuning, PostgreSQL"
Security Analyst,Cybersecurity,Capgemini,26 LPA,"Ethical Hacking, Firewall Management, Python, Network Security"
Frontend Developer,Web Development,TCS,12 LPA,"React, JavaScript, Git, HTML, CSS, Bootstrap"
Backend Developer,Web Development,Capgemini,12 LPA,"Python, Flask, APIs, Git"
Digital Marketing Specialist,Digital Marketing,Meta,12 LPA,"Content Marketing, Google Analytics, SEM, Email Marketing"
Cloud Engineer,Cloud Computing,Cisco,28 LPA,"Cloud Security, Terraform, AWS, Kubernetes, Docker"
Security Analyst,Cybersecurity,Meta,26 LPA,"Network Security, Incident Response, Firewall Management, Python, SIEM"
AI Engineer,Artificial Intelligence,Meta,25 LPA,"Computer Vision, Python, Deep Learning, NLP, TensorFlow, PyTorch"
Cloud Engineer,Cloud Computing,Google,28 LPA,"Linux, AWS, Terraform, Kubernetes, Docker, Cloud Security"
Database Administrator,Database Management,Capgemini,15 LPA,"Backup and Recovery, Oracle, SQL, Database Design"
Cloud Engineer,Cloud Computing,TCS,32 LPA,"Terraform, Linux, AWS, Kubernetes, Docker"
Security Analyst,Cybersecurity,Accenture,26 LPA,"Python, Network Security, Firewall Management, Incident Response"
Cloud Engineer,Cloud Computing,Cisco,32 LPA,"AWS, Docker, Linux, Kubernetes, Terraform"
Cloud Engineer,Cloud Computing,Deloitte,28 LPA,"Cloud Security, Terraform, AWS, Docker, Kubernetes"
Business Analyst,Business Analysis,Google,16 LPA,"Requirement Gathering, Excel, Power BI, SQL, Tableau"
AI Engineer,Artificial Intelligence,Deloitte,25 LPA,"NLP, Python, TensorFlow, Computer Vision"
Backend Developer,Web Development,Google,15 LPA,"Python, SQL, Git, APIs"
Data Analyst,Data Science,Deloitte,25 LPA,"SQL, Python, Tableau, Excel"
Frontend Developer,Web Development,Deloitte,15 LPA,"CSS, Git, React, JavaScript, Responsive Design"
Security Analyst,Cybersecurity,Google,30 LPA,"Ethical Hacking, Python, Firewall Management"
Business Analyst,Business Analysis,Meta,10 LPA,"Requirement Gathering, Tableau, Excel, SQL"
Security Analyst,Cybersecurity,Meta,30 LPA,"Network Security, Python, Firewall Management, Ethical Hacking"
Database Administrator,Database Management,Amazon,20 LPA,"Backup and Recovery, Database Design, Oracle, SQL, Performance Tuning"
Backend Developer,Web Development,TCS,12 LPA,"SQL, Git, Django, Flask, Python"
Backend Developer,Web Development,Deloitte,12 LPA,"Python, Flask, SQL, Django, Git, APIs, Bootstrap"
Senior Data Scientist,Data Science,Cisco,30 LPA,"Data Analysis, Machine Learning, Python, Statistics, Pandas, TensorFlow, Hadoop"
Security Analyst,Cybersecurity,Deloitte,22 LPA,"Firewall Management, Python, Network Security"
AI Engineer,Artificial Intelligence,Infosys,25 LPA,"NLP, Computer Vision, Deep Learning, PyTorch"
Backend Developer,Web Development,Microsoft,12 LPA,"Python, Flask, APIs, Git, SQL, Django"
DevOps Engineer,DevOps,Microsoft,28 LPA,"Linux, AWS, Docker, Kubernetes, Jenkins"
Digital Marketing Specialist,Digital Marketing,Accenture,12 LPA,"Google Analytics, Content Marketing, SEO, Email Marketing, SEM"
Senior Data Scientist,Data Science,Microsoft,25 LPA,"Data Analysis, Statistics, SQL, Pandas, Python"
Business Analyst,Business Analysis,Cisco,16 LPA,"Excel, Tableau, SQL, Requirement Gathering"
Business Analyst,Business Analysis,Meta,10 LPA,"Power BI, Business Analysis, Requirement Gathering, Tableau, Excel"
Security Analyst,Cybersecurity,Google,22 LPA,"Python, Incident Response, Network Security"
Digital Marketing Specialist,Digital Marketing,IBM,12 LPA,"SEO, SEM, Email Marketing, Content Marketing, Social Media Marketing"
Cloud Engineer,Cloud Computing,Deloitte,25 LPA,"Kubernetes, AWS, Terraform, Cloud Security, GCP"
Backend Developer,Web Development,Meta,12 LPA,"Flask, Python, SQL, Django, APIs, Git"
Digital Marketing Specialist,Digital Marketing,Accenture,8 LPA,"SEM, Google Analytics, Content Marketing, Email Marketing, Social Media Marketing"
Database Administrator,Database Management,Accenture,18 LPA,"Performance Tuning, Oracle, SQL, Backup and Recovery"
Backend Developer,Web Development,Meta,18 LPA,"Django, APIs, Git, SQL"
Senior Data Scientist,Data Science,Accenture,25 LPA,"Statistics, Python, TensorFlow, Pandas, Data Analysis, SQL, Machine Learning"
Senior Data Scientist,Data Science,Accenture,30 LPA,"TensorFlow, Python, Data Analysis, SQL, Machine Learning"
DevOps Engineer,DevOps,Amazon,32 LPA,"Linux, CI/CD, Kubernetes, AWS, Docker, Ansible"
Frontend Developer,Web Development,Cisco,15 LPA,"Responsive Design, JavaScript, HTML, CSS"
Security Analyst,Cybersecurity,Amazon,22 LPA,"Ethical Hacking, Python, Firewall Management, SIEM"
Digital Marketing Specialist,Digital Marketing,Capgemini,8 LPA,"Email Marketing, Google Analytics, Content Marketing, SEM, Social Media Marketing"
Cloud Engineer,Cloud Computing,Capgemini,25 LPA,"Cloud Security, Terraform, AWS, Kubernetes, Linux, Docker"
Business Analyst,Business Analysis,TCS,10 LPA,"Tableau, Power BI, Excel, Business Analysis, Requirement Gathering"
Digital Marketing Specialist,Digital Marketing,Capgemini,12 LPA,"Google Analytics, SEO, SEM, Content Marketing, Email Marketing, Social Media Marketing"
Backend Developer,Web Development,Meta,18 LPA,"SQL, Git, Python, Flask, Django, APIs"
Security Analyst,Cybersecurity,Meta,30 LPA,"Incident Response, Firewall Management, Python, Ethical Hacking"
Business Analyst,Business Analysis,TCS,10 LPA,"Power BI, SQL, Tableau, Business Analysis, Excel"
Business Analyst,Business Analysis,Microsoft,10 LPA,"Tableau, Requirement Gathering, Business Analysis, Power BI"
Backend Developer,Web Development,Deloitte,15 LPA,"APIs, SQL, Django, Git, Python, Next.js"
Business Analyst,Business Analysis,Infosys,10 LPA,"Excel, Tableau, SQL, Requirement Gathering, Agile Methodology"
Cloud Engineer,Cloud Computing,Meta,28 LPA,"AWS, Cloud Security, Docker, Terraform, Kubernetes"
AI Engineer,Artificial Intelligence,TCS,30 LPA,"Python, Deep Learning, TensorFlow, NLP, Computer Vision"
Frontend Developer,Web Development,Amazon,18 LPA,"JavaScript, React, Responsive Design, CSS"
Cloud Engineer,Cloud Computing,Amazon,25 LPA,"Cloud Security, Terraform, Linux, Docker, AWS"
Digital Marketing Specialist,Digital Marketing,Meta,12 LPA,"SEM, Google Analytics, Email Marketing, Content Marketing, SEO"
Java Developer,Software Engineering,Google,20 LPA,"Data Structures, Java, Maven, Spring Boot, OOP Concepts, SQL"
Business Analyst,Business Analysis,Microsoft,10 LPA,"SQL, Requirement Gathering, Business Analysis, Tableau"
Cloud Engineer,Cloud Computing,Capgemini,28 LPA,"Cloud Security, AWS, Kubernetes, Terraform, Azure"
Data Analyst,Data Science,Infosys,30 LPA,"Tableau, Excel, SQL, Statistics, Data Visualization, Python, PySpark"
Backend Developer,Web Development,Google,12 LPA,"Django, Flask, Python, Git, SQL, APIs, Next.js"
Backend Developer,Web Development,Deloitte,12 LPA,"Python, Git, Django, SQL, APIs, Flask"
Database Administrator,Database Management,IBM,15 LPA,"Oracle, Backup and Recovery, Performance Tuning"
AI Engineer,Artificial Intelligence,Meta,25 LPA,"Deep Learning, Python, NLP, TensorFlow, Computer Vision, PyTorch"
Cloud Engineer,Cloud Computing,Accenture,32 LPA,"AWS, Kubernetes, Terraform, Docker, Cloud Security, Linux"
Security Analyst,Cybersecurity,Meta,26 LPA,"Ethical Hacking, Firewall Management, Python, SIEM"
Business Analyst,Business Analysis,Microsoft,14 LPA,"Business Analysis, Requirement Gathering, Power BI, Tableau, Excel"
Security Analyst,Cybersecurity,Deloitte,30 LPA,"Network Security, Python, Incident Response, Ethical Hacking"
Backend Developer,Web Development,Meta,15 LPA,"Python, SQL, APIs, Django, Flask, Git"
Java Developer,Software Engineering,Capgemini,14 LPA,"SQL, OOP Concepts, Data Structures, Spring Boot, Java, Maven, JUnit"
Database Administrator,Database Management,TCS,18 LPA,"Backup and Recovery, Performance Tuning, SQL, Database Design, Oracle"
Frontend Developer,Web Development,IBM,12 LPA,"React, HTML, JavaScript, Responsive Design, Bootstrap"
Backend Developer,Web Development,Infosys,12 LPA,"Flask, Django, SQL, APIs, Git"
Java Developer,Software Engineering,Accenture,20 LPA,"Maven, SQL, Data Structures, OOP Concepts"
Digital Marketing Specialist,Digital Marketing,Deloitte,8 LPA,"Email Marketing, Google Analytics, SEO, SEM, Content Marketing"
Data Analyst,Data Science,Deloitte,30 LPA,"Data Visualization, SQL, Excel, Python, Statistics, Tableau"
DevOps Engineer,DevOps,Meta,32 LPA,"Kubernetes, CI/CD, Docker, AWS, Linux"
Data Analyst,Data Science,Amazon,25 LPA,"Data Visualization, Excel, Statistics, Tableau"
Backend Developer,Web Development,Google,12 LPA,"Flask, APIs, SQL, Python, Git, Django"
Cloud Engineer,Cloud Computing,Amazon,25 LPA,"Terraform, Kubernetes, Cloud Security, Linux, AWS"
Security Analyst,Cybersecurity,IBM,30 LPA,"Ethical Hacking, Network Security, Firewall Management, Cryptography"
Business Analyst,Business Analysis,Infosys,10 LPA,"Power BI, Business Analysis, Excel, Tableau, Requirement Gathering, SQL"
Digital Marketing Specialist,Digital Marketing,Microsoft,10 LPA,"Google Analytics, Content Marketing, SEO"
Java Developer,Software Engineering,Microsoft,20 LPA,"Spring Boot, OOP Concepts, Java, SQL, Data Structures, JUnit"
Database Administrator,Database Management,IBM,20 LPA,"Oracle, Database Design, Performance Tuning, Backup and Recovery, SQL, PostgreSQL"
Java Developer,Software Engineering,Accenture,14 LPA,"Data Structures, Spring Boot, OOP Concepts, SQL"
Frontend Developer,Web Development,Microsoft,12 LPA,"Git, Responsive Design, CSS, React, JavaScript, HTML"
AI Engineer,Artificial Intelligence,Cisco,30 LPA,"NLP, Deep Learning, Python, TensorFlow"
Security Analyst,Cybersecurity,Accenture,26 LPA,"Ethical Hacking, Network Security, Incident Response"
AI Engineer,Artificial Intelligence,IBM,35 LPA,"Deep Learning, Computer Vision, Python"
Business Analyst,Business Analysis,Capgemini,10 LPA,"Tableau, SQL, Power BI, Requirement Gathering, Business Analysis, Excel"
DevOps Engineer,DevOps,Cisco,24 LPA,"Linux, Kubernetes, Jenkins, Docker, CI/CD, AWS"
Database Administrator,Database Management,TCS,18 LPA,"SQL, Backup and Recovery, Database Design, Performance Tuning, Oracle"
Cloud Engineer,Cloud Computing,Cisco,28 LPA,"AWS, Docker, Kubernetes, Linux, Terraform"
Backend Developer,Web Development,Microsoft,12 LPA,"Django, Python, APIs, Flask, SQL"
Database Administrator,Database Management,Deloitte,20 LPA,"Database Design, Backup and Recovery, SQL, Performance Tuning"
Frontend Developer,Web Development,Amazon,15 LPA,"CSS, React, JavaScript, Git"
Digital Marketing Specialist,Digital Marketing,IBM,10 LPA,"Email Marketing, SEO, SEM, Social Media Marketing"
Frontend Developer,Web Development,Google,15 LPA,"CSS, JavaScript, Responsive Design, React, Git, HTML"
Frontend Developer,Web Development,Cisco,12 LPA,"JavaScript, React, HTML, CSS, Responsive Design, Git, Next.js"
Database Administrator,Database Management,Amazon,20 LPA,"Database Design, Oracle, Backup and Recovery, Performance Tuning, SQL"
Backend Developer,Web Development,Meta,15 LPA,"Git, APIs, Python, Flask"
Frontend Developer,Web Development,Google,12 LPA,"React, JavaScript, Responsive Design, CSS, HTML, Git, Bootstrap"
Business Analyst,Business Analysis,IBM,14 LPA,"Requirement Gathering, SQL, Power BI, Business Analysis"
DevOps Engineer,DevOps,Capgemini,32 LPA,"Kubernetes, Docker, Jenkins, Linux, CI/CD"
Data Analyst,Data Science,Cisco,30 LPA,"Statistics, Excel, Data Visualization, SQL, Python"
Digital Marketing Specialist,Digital Marketing,Capgemini,12 LPA,"SEO, Email Marketing, Content Marketing, SEM, Google Analytics"
Cloud Engineer,Cloud Computing,Deloitte,28 LPA,"Linux, Kubernetes, AWS, Cloud Security, Docker"
Database Administrator,Database Management,IBM,15 LPA,"Performance Tuning, Backup and Recovery, Oracle, Database Design"
Security Analyst,Cybersecurity,Microsoft,26 LPA,"Incident Response, Ethical Hacking, Network Security, Python"
AI Engineer,Artificial Intelligence,Cisco,35 LPA,"NLP, TensorFlow, Computer Vision, PyTorch"
Backend Developer,Web Development,Google,12 LPA,"SQL, Flask, Git, APIs, Django"
Database Administrator,Database Management,Amazon,18 LPA,"Backup and Recovery, Database Design, Performance Tuning, SQL"
Cloud Engineer,Cloud Computing,Cisco,25 LPA,"Docker, AWS, Cloud Security, Linux"
AI Engineer,Artificial Intelligence,Cisco,35 LPA,"Deep Learning, Computer Vision, NLP"
DevOps Engineer,DevOps,Capgemini,32 LPA,"Jenkins, Linux, Kubernetes, CI/CD, AWS, Docker"
Business Analyst,Business Analysis,Microsoft,16 LPA,"Excel, Requirement Gathering, SQL, Business Analysis, Tableau, Power BI, Agile Methodology"
Java Developer,Software Engineering,Cisco,14 LPA,"Spring Boot, OOP Concepts, SQL, Maven, Java"
Database Administrator,Database Management,Cisco,20 LPA,"SQL, Performance Tuning, Database Design, Backup and Recovery, Oracle"
Frontend Developer,Web Development,Amazon,15 LPA,"JavaScript, React, CSS, Git, Responsive Design, Bootstrap"
Security Analyst,Cybersecurity,Accenture,22 LPA,"Incident Response, Python, Network Security"
Senior Data Scientist,Data Science,Cisco,25 LPA,"TensorFlow, Machine Learning, Pandas, Statistics, Data Analysis, Python"
Cloud Engineer,Cloud Computing,Deloitte,28 LPA,"AWS, Docker, Kubernetes, Cloud Security"
Frontend Developer,Web Development,IBM,12 LPA,"Git, HTML, JavaScript, React, CSS, Responsive Design, Next.js"
Java Developer,Software Engineering,Microsoft,14 LPA,"OOP Concepts, Maven, Java, Data Structures, JUnit"
Digital Marketing Specialist,Digital Marketing,Microsoft,8 LPA,"Google Analytics, Email Marketing, SEO, SEM"
DevOps Engineer,DevOps,Deloitte,24 LPA,"Docker, CI/CD, Kubernetes, Jenkins, AWS, Linux"
Database Administrator,Database Management,Microsoft,18 LPA,"Oracle, Database Design, Backup and Recovery"
DevOps Engineer,DevOps,Capgemini,32 LPA,"CI/CD, Docker, AWS, Linux"
DevOps Engineer,DevOps,Capgemini,32 LPA,"CI/CD, Jenkins, Docker, Linux, Kubernetes"
Data Analyst,Data Science,Cisco,25 LPA,"SQL, Statistics, Excel, Data Visualization, Python"
Cloud Engineer,Cloud Computing,Amazon,32 LPA,"Terraform, Linux, AWS, Kubernetes"
Senior Data Scientist,Data Science,Microsoft,25 LPA,"TensorFlow, SQL, Data Analysis, Machine Learning, Pandas"
Business Analyst,Business Analysis,Meta,16 LPA,"SQL, Business Analysis, Power BI, Requirement Gathering, Excel, Tableau"
Business Analyst,Business Analysis,IBM,10 LPA,"Requirement Gathering, SQL, Excel, Business Analysis"
DevOps Engineer,DevOps,TCS,28 LPA,"Linux, Docker, CI/CD, Jenkins, Kubernetes, AWS"
AI Engineer,Artificial Intelligence,Meta,30 LPA,"Computer Vision, NLP, TensorFlow"
AI Engineer,Artificial Intelligence,TCS,35 LPA,"Deep Learning, Python, NLP, TensorFlow, Computer Vision, PyTorch"
Senior Data Scientist,Data Science,Microsoft,25 LPA,"Pandas, Statistics, SQL, Python, Data Analysis"
Database Administrator,Database Management,Accenture,18 LPA,"SQL, Oracle, Backup and Recovery, Database Design, Performance Tuning"
Cloud Engineer,Cloud Computing,TCS,25 LPA,"Linux, Terraform, Kubernetes, Cloud Security, AWS"
Senior Data Scientist,Data Science,Meta,25 LPA,"Python, Pandas, Machine Learning, Statistics, Data Analysis, TensorFlow"
Security Analyst,Cybersecurity,Infosys,26 LPA,"Network Security, Incident Response, Firewall Management, Ethical Hacking"
Security Analyst,Cybersecurity,TCS,30 LPA,"Network Security, Python, Incident Response, Firewall Management, Cryptography"
DevOps Engineer,DevOps,Google,32 LPA,"Kubernetes, Jenkins, Docker, AWS, CI/CD"
Data Analyst,Data Science,TCS,25 LPA,"SQL, Python, Data Visualization, Excel"
Business Analyst,Business Analysis,IBM,10 LPA,"Business Analysis, Tableau, Excel, SQL, Requirement Gathering"
Frontend Developer,Web Development,Accenture,18 LPA,"HTML, React, CSS, Git, JavaScript"
Frontend Developer,Web Development,Capgemini,18 LPA,"CSS, JavaScript, React, HTML, Responsive Design, Git"
Java Developer,Software Engineering,TCS,20 LPA,"Spring Boot, SQL, Data Structures, Maven, Java"
AI Engineer,Artificial Intelligence,Accenture,30 LPA,"Python, Computer Vision, Deep Learning, PyTorch"
Data Analyst,Data Science,Amazon,20 LPA,"Excel, Python, Tableau, SQL"
Cloud Engineer,Cloud Computing,Amazon,28 LPA,"Cloud Security, Linux, Kubernetes, AWS"
Data Analyst,Data Science,Accenture,30 LPA,"Tableau, Data Visualization, Excel, Statistics"
Business Analyst,Business Analysis,TCS,16 LPA,"SQL, Requirement Gathering, Business Analysis, Tableau, Excel, Power BI"
AI Engineer,Artificial Intelligence,TCS,35 LPA,"Computer Vision, Python, Deep Learning"
Java Developer,Software Engineering,Meta,20 LPA,"OOP Concepts, Maven, SQL, Spring Boot, Hibernate"
Senior Data Scientist,Data Science,Cisco,30 LPA,"Data Analysis, TensorFlow, Statistics, Pandas, Python, PySpark"
Digital Marketing Specialist,Digital Marketing,Google,12 LPA,"Google Analytics, Content Marketing, SEM, SEO"
Business Analyst,Business Analysis,Microsoft,10 LPA,"Business Analysis, SQL, Tableau, Requirement Gathering"
Java Developer,Software Engineering,Deloitte,14 LPA,"Java, Spring Boot, OOP Concepts, Maven, Hibernate"
Frontend Developer,Web Development,Accenture,15 LPA,"HTML, React, CSS, Git"
Cloud Engineer,Cloud Computing,Accenture,32 LPA,"Kubernetes, Terraform, AWS, Linux"
Database Administrator,Database Management,Google,15 LPA,"SQL, Performance Tuning, Oracle, PostgreSQL"
Cloud Engineer,Cloud Computing,Accenture,28 LPA,"Cloud Security, Linux, AWS, Docker, Terraform, Kubernetes"
Java Developer,Software Engineering,Cisco,14 LPA,"Maven, SQL, Spring Boot, Java, OOP Concepts, JUnit"
Senior Data Scientist,Data Science,Google,20 LPA,"Pandas, Python, SQL, TensorFlow, Statistics"
Database Administrator,Database Management,Meta,15 LPA,"Backup and Recovery, SQL, Performance Tuning"
Business Analyst,Business Analysis,Accenture,14 LPA,"Excel, SQL, Power BI, Tableau, Requirement Gathering, Business Analysis"
